{
  "$version": "1.0",
  "description": "CAG India audit topics taxonomy. 33 top-level topics, 224 sub-topics. Derived from the Seventh, Eleventh and Twelfth Schedules of the Constitution of India. Used in inheritable_audit_metadata.topics[] at report and chapter level. IDs are snake_case strings. parent_id=null marks top-level topics. sub_topics[] on parent entries lists direct child IDs. INHERITANCE: ADDITIVE — chapter topics aggregate upward to report level.",
  "usage_notes": "Use the most specific applicable sub_topic ID, not the parent topic. Multiple IDs permitted. Set at REPORT level for report-wide themes; set at CHAPTER level for chapter-specific themes. Do not set at SECTION level. Pipeline aggregates: report.topics = union(explicit report.metadata.topics, all chapter.metadata.topics).",
  "entries": [
    {
      "id": "defence_security",
      "label": {
        "en": "Defence & National Security",
        "hi": "रक्षा एवं राष्ट्रीय सुरक्षा"
      },
      "short_label": {
        "en": "Defence & National Security"
      },
      "level": "topic",
      "parent_id": null,
      "description": {
        "en": ""
      },
      "deprecated": false,
      "sub_topics": [
        "defence_procurement",
        "armed_forces_welfare",
        "border_infrastructure",
        "defence_psu",
        "internal_security_expenditure"
      ],
      "sort_order": 1
    },
    {
      "id": "defence_procurement",
      "label": {
        "en": "Defence Procurement & Capital Expenditure",
        "hi": "रक्षा खरीद एवं पूंजीगत व्यय"
      },
      "short_label": {
        "en": "Defence Procurement"
      },
      "level": "sub_topic",
      "parent_id": "defence_security",
      "description": {
        "en": ""
      },
      "deprecated": false,
      "sort_order": 2
    },
    {
      "id": "armed_forces_welfare",
      "label": {
        "en": "Armed Forces Welfare & Cantonments",
        "hi": "सशस्त्र बलों का कल्याण एवं छावनियाँ"
      },
      "short_label": {
        "en": "Armed Forces Welfare & Cantonments"
      },
      "level": "sub_topic",
      "parent_id": "defence_security",
      "description": {
        "en": ""
      },
      "deprecated": false,
      "sort_order": 3
    },
    {
      "id": "border_infrastructure",
      "label": {
        "en": "Border Infrastructure Construction",
        "hi": "सीमा अवसंरचना निर्माण"
      },
      "short_label": {
        "en": "Border Infrastructure Construction"
      },
      "level": "sub_topic",
      "parent_id": "defence_security",
      "description": {
        "en": ""
      },
      "deprecated": false,
      "sort_order": 4
    },
    {
      "id": "defence_psu",
      "label": {
        "en": "Defence PSUs & Ordnance Factories",
        "hi": "रक्षा सार्वजनिक उपक्रम एवं आयुध कारखाने"
      },
      "short_label": {
        "en": "Defence PSUs & Ordnance"
      },
      "level": "sub_topic",
      "parent_id": "defence_security",
      "description": {
        "en": ""
      },
      "deprecated": false,
      "sort_order": 5
    },
    {
      "id": "internal_security_expenditure",
      "label": {
        "en": "Intelligence & Internal Security Expenditure",
        "hi": "खुफिया एवं आंतरिक सुरक्षा व्यय"
      },
      "short_label": {
        "en": "Intelligence"
      },
      "level": "sub_topic",
      "parent_id": "defence_security",
      "description": {
        "en": ""
      },
      "deprecated": false,
      "sort_order": 6
    },
    {
      "id": "foreign_affairs",
      "label": {
        "en": "Foreign Affairs & International Relations",
        "hi": "विदेश मामले एवं अंतरराष्ट्रीय संबंध"
      },
      "short_label": {
        "en": "Foreign Affairs"
      },
      "level": "topic",
      "parent_id": null,
      "description": {
        "en": ""
      },
      "deprecated": false,
      "sub_topics": [
        "treaty_implementation",
        "diplomatic_missions",
        "multilateral_contributions",
        "foreign_aid"
      ],
      "sort_order": 7
    },
    {
      "id": "treaty_implementation",
      "label": {
        "en": "Treaty & Agreement Implementation",
        "hi": "संधि एवं समझौता क्रियान्वयन"
      },
      "short_label": {
        "en": "Treaty & Agreement Implementation"
      },
      "level": "sub_topic",
      "parent_id": "foreign_affairs",
      "description": {
        "en": ""
      },
      "deprecated": false,
      "sort_order": 8
    },
    {
      "id": "diplomatic_missions",
      "label": {
        "en": "Diplomatic Mission Operations & Costs",
        "hi": "राजनयिक मिशन परिचालन एवं लागत"
      },
      "short_label": {
        "en": "Diplomatic Mission Operations"
      },
      "level": "sub_topic",
      "parent_id": "foreign_affairs",
      "description": {
        "en": ""
      },
      "deprecated": false,
      "sort_order": 9
    },
    {
      "id": "multilateral_contributions",
      "label": {
        "en": "UN & Multilateral Contributions",
        "hi": "संयुक्त राष्ट्र एवं बहुपक्षीय अंशदान"
      },
      "short_label": {
        "en": "UN & Multilateral Contributions"
      },
      "level": "sub_topic",
      "parent_id": "foreign_affairs",
      "description": {
        "en": ""
      },
      "deprecated": false,
      "sort_order": 10
    },
    {
      "id": "foreign_aid",
      "label": {
        "en": "Foreign Aid Disbursement & Utilisation",
        "hi": "विदेशी सहायता वितरण एवं उपयोग"
      },
      "short_label": {
        "en": "Foreign Aid Disbursement"
      },
      "level": "sub_topic",
      "parent_id": "foreign_affairs",
      "description": {
        "en": ""
      },
      "deprecated": false,
      "sort_order": 11
    },
    {
      "id": "railways",
      "label": {
        "en": "Railways",
        "hi": "रेलवे"
      },
      "short_label": {
        "en": "Railways"
      },
      "level": "topic",
      "parent_id": null,
      "description": {
        "en": ""
      },
      "deprecated": false,
      "sub_topics": [
        "railway_capital_works",
        "rolling_stock",
        "railway_safety",
        "railway_psu",
        "railway_passenger",
        "railway_station"
      ],
      "sort_order": 12
    },
    {
      "id": "railway_capital_works",
      "label": {
        "en": "Railway Capital Works & Project Execution",
        "hi": "रेलवे पूंजीगत कार्य एवं परियोजना क्रियान्वयन"
      },
      "short_label": {
        "en": "Railway Capital Works"
      },
      "level": "sub_topic",
      "parent_id": "railways",
      "description": {
        "en": ""
      },
      "deprecated": false,
      "sort_order": 13
    },
    {
      "id": "rolling_stock",
      "label": {
        "en": "Rolling Stock Procurement",
        "hi": "रोलिंग स्टॉक खरीद"
      },
      "short_label": {
        "en": "Rolling Stock Procurement"
      },
      "level": "sub_topic",
      "parent_id": "railways",
      "description": {
        "en": ""
      },
      "deprecated": false,
      "sort_order": 14
    },
    {
      "id": "railway_safety",
      "label": {
        "en": "Railway Safety & Accident Prevention",
        "hi": "रेलवे सुरक्षा एवं दुर्घटना निवारण"
      },
      "short_label": {
        "en": "Railway Safety"
      },
      "level": "sub_topic",
      "parent_id": "railways",
      "description": {
        "en": ""
      },
      "deprecated": false,
      "sort_order": 15
    },
    {
      "id": "railway_psu",
      "label": {
        "en": "Railway PSU Performance",
        "hi": "रेलवे सार्वजनिक उपक्रम निष्पादन"
      },
      "short_label": {
        "en": "Railway PSU Performance"
      },
      "level": "sub_topic",
      "parent_id": "railways",
      "description": {
        "en": ""
      },
      "deprecated": false,
      "sort_order": 16
    },
    {
      "id": "railway_passenger",
      "label": {
        "en": "Passenger Amenities & Service Delivery",
        "hi": "यात्री सुविधाएं एवं सेवा प्रदायगी"
      },
      "short_label": {
        "en": "Passenger Amenities"
      },
      "level": "sub_topic",
      "parent_id": "railways",
      "description": {
        "en": ""
      },
      "deprecated": false,
      "sort_order": 17
    },
    {
      "id": "railway_station",
      "label": {
        "en": "Station Development & Redevelopment",
        "hi": "स्टेशन विकास एवं पुनर्विकास"
      },
      "short_label": {
        "en": "Station Development & Redevelopment"
      },
      "level": "sub_topic",
      "parent_id": "railways",
      "description": {
        "en": ""
      },
      "deprecated": false,
      "sort_order": 18
    },
    {
      "id": "road_transport",
      "label": {
        "en": "Road Transport & Highways",
        "hi": "सड़क परिवहन एवं राजमार्ग"
      },
      "short_label": {
        "en": "Road Transport & Highways"
      },
      "level": "topic",
      "parent_id": null,
      "description": {
        "en": ""
      },
      "deprecated": false,
      "sub_topics": [
        "national_highways",
        "toll_ppp",
        "road_safety",
        "nhai_delivery",
        "road_construction_quality"
      ],
      "sort_order": 19
    },
    {
      "id": "national_highways",
      "label": {
        "en": "National Highway Construction & Maintenance",
        "hi": "राष्ट्रीय राजमार्ग निर्माण एवं रखरखाव"
      },
      "short_label": {
        "en": "National Highway Construction"
      },
      "level": "sub_topic",
      "parent_id": "road_transport",
      "description": {
        "en": ""
      },
      "deprecated": false,
      "sort_order": 20
    },
    {
      "id": "toll_ppp",
      "label": {
        "en": "Toll Collection & PPP Concessions",
        "hi": "टोल संग्रह एवं पीपीपी रियायतें"
      },
      "short_label": {
        "en": "Toll Collection & PPP"
      },
      "level": "sub_topic",
      "parent_id": "road_transport",
      "description": {
        "en": ""
      },
      "deprecated": false,
      "sort_order": 21
    },
    {
      "id": "road_safety",